{
  "apia": "1.0",
  "service": {
    "id": "spoonacular",
    "name": "Spoonacular API",
    "description_for_ai": "Food and recipe API. 5000+ recipes, nutrition analysis, meal planning, grocery lists, ingredient substitutions, wine pairing. Search by diet (vegan, keto, gluten-free), ingredients, cuisine. 150 req/day free.",
    "url": "https://spoonacular.com",
    "api_base": "https://api.spoonacular.com",
    "category": "food",
    "geo": [
      "GLOBAL"
    ],
    "language": "en",
    "docs": "https://spoonacular.com/food-api/docs"
  },
  "auth": {
    "type": "apikey",
    "anonymous_access": false,
    "param_name": "apiKey",
    "param_location": "query",
    "how_to_get": "Register at https://spoonacular.com/food-api/console",
    "cost": "Free: 150 points/day. Basic: $29/month"
  },
  "capabilities": [
    {
      "id": "search_recipes",
      "description_for_ai": "Search recipes by query, diet, cuisine, ingredients. Returns recipes with nutrition info.",
      "intent": [
        "find recipe",
        "diet recipe",
        "vegan recipe",
        "keto meal",
        "recipe search",
        "gluten free",
        "low calorie"
      ],
      "endpoint": "GET https://api.spoonacular.com/recipes/complexSearch",
      "input": {
        "query": {
          "type": "string",
          "required": false,
          "description": "Search query string"
        },
        "diet": {
          "type": "string",
          "description": "vegetarian, vegan, gluten free, ketogenic, paleo, primal",
          "required": false
        },
        "cuisine": {
          "type": "string",
          "description": "italian, mexican, chinese, indian, japanese, french",
          "required": false
        },
        "maxCalories": {
          "type": "integer",
          "required": false
        },
        "minProtein": {
          "type": "integer",
          "required": false
        },
        "intolerances": {
          "type": "string",
          "description": "dairy, egg, gluten, peanut, seafood, sesame",
          "required": false
        },
        "number": {
          "type": "integer",
          "default": 10
        }
      },
      "output": {
        "type": "list<recipe>",
        "fields": [
          "id",
          "title",
          "image",
          "calories",
          "protein",
          "fat",
          "carbs"
        ]
      },
      "realtime": false,
      "requires_auth": true
    },
    {
      "id": "analyze_nutrition",
      "description_for_ai": "Get nutrition info for any food or recipe text. Returns calories, macros, vitamins.",
      "intent": [
        "nutrition facts",
        "calories in food",
        "macro breakdown",
        "analyze nutrition",
        "food nutrition"
      ],
      "endpoint": "POST https://api.spoonacular.com/recipes/analyze",
      "input": {
        "title": {
          "type": "string",
          "required": true,
          "description": "Title or name string"
        },
        "ingr": {
          "type": "array",
          "description": "List of ingredients",
          "required": true
        }
      },
      "output": {
        "type": "nutrition",
        "fields": [
          "calories",
          "fat",
          "protein",
          "carbs",
          "fiber",
          "vitamins"
        ]
      },
      "realtime": false,
      "requires_auth": true
    }
  ],
  "meta": {
    "apia_version": "1.0",
    "manifest_author": "APIA community",
    "last_verified": "2026-06-14"
  }
}